{
  "$schema": "https://json-schema.org/draft/2020-12/schema",
  "$id": "calibration.schema.json",
  "title": "Calibration",
  "description": "trajectory/profiles/calibration.json — the measured numbers exp000 produces. The adapter READS this file at runtime for stage budgets and noise floors; the agent WRITES it exactly once (exp000) and never hand-edits it after Phase-1 starts. This exists because the agent is forbidden from editing adapter.py — measured state lives in the trajectory, not in code.",
  "type": "object",
  "required": [
    "s1_epochs",
    "s2_epochs",
    "noise_floor_s1_map50",
    "noise_floor_s2_map50",
    "measured_by",
    "seeds_used"
  ],
  "properties": {
    "s1_epochs": {
      "type": "integer",
      "minimum": 1,
      "description": "Stage-1 screening budget. Roughly 1/3 of s2_epochs, from the exp000 curve."
    },
    "s2_epochs": {
      "type": "integer",
      "minimum": 1,
      "description": "Stage-2 full budget: just past where the exp000 vanilla val-mAP50 slope flattens."
    },
    "noise_floor_s1_map50": {
      "type": "number",
      "minimum": 0,
      "description": "max-min mAP50 spread across >=3 vanilla seeds at the S1 budget."
    },
    "noise_floor_s2_map50": {
      "type": "number",
      "minimum": 0,
      "description": "max-min mAP50 spread across >=3 vanilla seeds at the S2 budget."
    },
    "measured_by": {
      "type": "string",
      "pattern": "^exp[0-9]{3,}$",
      "description": "The experiment that produced these numbers (normally 'exp000')."
    },
    "seeds_used": {
      "type": "object",
      "required": ["working", "confirmation"],
      "properties": {
        "working": {
          "type": "array",
          "items": { "type": "integer" },
          "minItems": 3,
          "description": "Seeds the noise floors were measured on."
        },
        "confirmation": {
          "type": "array",
          "items": { "type": "integer" },
          "minItems": 2,
          "description": "Sealed P11 seeds whose baseline legs exp000 also ran."
        }
      }
    },
    "epoch_probe_curve": {
      "type": "array",
      "items": { "type": "number" },
      "description": "Optional: the per-epoch mAP50 curve from the generous-cap probe run, so the s2_epochs choice can be audited later."
    },
    "notes": { "type": "string" }
  }
}
