{
  "s1_epochs": 30,
  "s2_epochs": 80,
  "noise_floor_s1_map50": 0.006610594673606612,
  "noise_floor_s2_map50": 0.004967419437789278,
  "measured_by": "exp000",
  "seeds_used": {
    "working": [
      42,
      123,
      7
    ],
    "confirmation": [
      1000,
      2000
    ]
  },
  "epoch_probe_curve": [
    0.00371,
    0.0406,
    0.07635,
    0.10569,
    0.12534,
    0.14082,
    0.15004,
    0.16113,
    0.17491,
    0.17563,
    0.17405,
    0.19578,
    0.19947,
    0.20893,
    0.20917,
    0.21105,
    0.22191,
    0.21819,
    0.2275,
    0.22775,
    0.22615,
    0.22553,
    0.23137,
    0.23282,
    0.23352,
    0.2402,
    0.24259,
    0.24217,
    0.24082,
    0.24595,
    0.25361,
    0.25089,
    0.24809,
    0.25575,
    0.25254,
    0.25713,
    0.2569,
    0.25939,
    0.26316,
    0.25191,
    0.26664,
    0.26349,
    0.26223,
    0.26042,
    0.26463,
    0.26893,
    0.26695,
    0.27033,
    0.26748,
    0.27084,
    0.26526,
    0.26905,
    0.27386,
    0.27622,
    0.27524,
    0.27263,
    0.27804,
    0.27875,
    0.27851,
    0.27712,
    0.27826,
    0.27873,
    0.2779,
    0.28002,
    0.27816,
    0.28092,
    0.28251,
    0.28239,
    0.28282,
    0.28806,
    0.28377,
    0.28703,
    0.28734,
    0.28753,
    0.28749,
    0.28504,
    0.28734,
    0.2852,
    0.28684,
    0.28808,
    0.28812,
    0.2875,
    0.28839,
    0.28865,
    0.2911,
    0.29046,
    0.28975,
    0.29305,
    0.29109,
    0.291,
    0.29252,
    0.29336,
    0.29273,
    0.28994,
    0.29057,
    0.29167,
    0.29193,
    0.2914,
    0.29257,
    0.29277,
    0.29218,
    0.2913,
    0.29185,
    0.29182,
    0.29192,
    0.29089,
    0.28967,
    0.29081,
    0.29119,
    0.29071,
    0.2917,
    0.29228,
    0.29196,
    0.29132,
    0.29147,
    0.2919,
    0.29269,
    0.29185,
    0.29145,
    0.2918,
    0.29245,
    0.29273,
    0.29294,
    0.29319,
    0.29266,
    0.29254,
    0.29184,
    0.29187,
    0.29237,
    0.29251,
    0.29304,
    0.29303,
    0.29336,
    0.29384,
    0.2938,
    0.29372,
    0.29331,
    0.29421,
    0.29471,
    0.29507,
    0.29539,
    0.29536,
    0.29484,
    0.29511,
    0.29502,
    0.29488,
    0.29482,
    0.29553,
    0.2956,
    0.29578,
    0.29567,
    0.29566,
    0.29567,
    0.29542,
    0.29562,
    0.2958,
    0.2957,
    0.29539,
    0.29543,
    0.29536,
    0.29517,
    0.29522,
    0.29502,
    0.29502,
    0.29482,
    0.29496,
    0.29485,
    0.29525,
    0.29533,
    0.29535,
    0.2954,
    0.29531,
    0.29554,
    0.2958,
    0.29583,
    0.29552,
    0.2957,
    0.2958,
    0.29574,
    0.29555,
    0.29562,
    0.2957,
    0.29573,
    0.29572,
    0.29592,
    0.29571,
    0.29602,
    0.29576,
    0.29551,
    0.29585,
    0.2955,
    0.29548,
    0.29565,
    0.29584,
    0.29574,
    0.29609,
    0.29588,
    0.29587,
    0.29573,
    0.29574
  ],
  "notes": "budget rule: 97%-of-smoothed-peak, ceil10, s2 in [60,150], s1=s2/3 in [10,60]; min/epoch=0.547; eval checkpoint locked to last.pt (2026-09-07)"
}